{
  "$defs": {
    "CityPrice": {
      "additionalProperties": false,
      "properties": {
        "city": {
          "anyOf": [
            {
              "type": "string"
            },
            {
              "type": "null"
            }
          ],
          "title": "City"
        },
        "listing_count": {
          "minimum": 0,
          "title": "Listing Count",
          "type": "integer"
        },
        "lower_quartile_pkr": {
          "anyOf": [
            {
              "type": "number"
            },
            {
              "type": "null"
            }
          ],
          "title": "Lower Quartile Pkr"
        },
        "make": {
          "title": "Make",
          "type": "string"
        },
        "median_mileage_km": {
          "anyOf": [
            {
              "type": "number"
            },
            {
              "type": "null"
            }
          ],
          "title": "Median Mileage Km"
        },
        "median_price_pkr": {
          "anyOf": [
            {
              "type": "number"
            },
            {
              "type": "null"
            }
          ],
          "title": "Median Price Pkr"
        },
        "model": {
          "title": "Model",
          "type": "string"
        },
        "model_year": {
          "anyOf": [
            {
              "type": "integer"
            },
            {
              "type": "null"
            }
          ],
          "title": "Model Year"
        },
        "observed_through": {
          "title": "Observed Through",
          "type": "string"
        },
        "priced_listing_count": {
          "minimum": 0,
          "title": "Priced Listing Count",
          "type": "integer"
        },
        "status": {
          "enum": [
            "ok",
            "insufficient_data"
          ],
          "title": "Status",
          "type": "string"
        },
        "transmission": {
          "anyOf": [
            {
              "type": "string"
            },
            {
              "type": "null"
            }
          ],
          "title": "Transmission"
        },
        "upper_quartile_pkr": {
          "anyOf": [
            {
              "type": "number"
            },
            {
              "type": "null"
            }
          ],
          "title": "Upper Quartile Pkr"
        }
      },
      "required": [
        "make",
        "model",
        "city",
        "model_year",
        "transmission",
        "listing_count",
        "priced_listing_count",
        "median_price_pkr",
        "lower_quartile_pkr",
        "upper_quartile_pkr",
        "median_mileage_km",
        "observed_through",
        "status"
      ],
      "title": "CityPrice",
      "type": "object"
    }
  },
  "$schema": "https://json-schema.org/draft/2020-12/schema",
  "additionalProperties": false,
  "properties": {
    "bundle_id": {
      "pattern": "^[a-f0-9]{64}$",
      "title": "Bundle Id",
      "type": "string"
    },
    "data": {
      "items": {
        "$ref": "#/$defs/CityPrice"
      },
      "title": "Data",
      "type": "array"
    },
    "generated_at": {
      "format": "date-time",
      "title": "Generated At",
      "type": "string"
    },
    "schema_version": {
      "const": "1.1.0",
      "default": "1.1.0",
      "title": "Schema Version",
      "type": "string"
    }
  },
  "required": [
    "schema_version",
    "generated_at",
    "bundle_id",
    "data"
  ],
  "title": "CityPricesPartExport",
  "type": "object"
}
