{
  "bundle_id": "427147898827bb2814afcf5157f7b797e4cf69ebe190e0192ec8e5a5d981eca0",
  "data": [
    {
      "city": "Karachi",
      "listing_count": 8,
      "lower_quartile_pkr": 5506250.0,
      "make": "Toyota",
      "median_mileage_km": 50900.0,
      "median_price_pkr": 6312500.0,
      "model": "Corolla",
      "model_year": 2022,
      "observed_through": "2026-10-31",
      "priced_listing_count": 8,
      "status": "ok",
      "transmission": "automatic",
      "upper_quartile_pkr": 6550000.0
    },
    {
      "city": "Karachi",
      "listing_count": 8,
      "lower_quartile_pkr": 5425000.0,
      "make": "Toyota",
      "median_mileage_km": 57000.0,
      "median_price_pkr": 5667500.0,
      "model": "Raize",
      "model_year": 2020,
      "observed_through": "2026-10-31",
      "priced_listing_count": 8,
      "status": "ok",
      "transmission": "automatic",
      "upper_quartile_pkr": 5968750.0
    },
    {
      "city": "Islamabad",
      "listing_count": 5,
      "lower_quartile_pkr": 5550000.0,
      "make": "Toyota",
      "median_mileage_km": 59000.0,
      "median_price_pkr": 6150000.0,
      "model": "Raize",
      "model_year": 2021,
      "observed_through": "2026-10-31",
      "priced_listing_count": 5,
      "status": "ok",
      "transmission": "automatic",
      "upper_quartile_pkr": 6275000.0
    },
    {
      "city": "Karachi",
      "listing_count": 7,
      "lower_quartile_pkr": 5275000.0,
      "make": "Toyota",
      "median_mileage_km": 31500.0,
      "median_price_pkr": 5665000.0,
      "model": "Raize",
      "model_year": 2021,
      "observed_through": "2026-10-31",
      "priced_listing_count": 7,
      "status": "ok",
      "transmission": "automatic",
      "upper_quartile_pkr": 5925000.0
    },
    {
      "city": "Lahore",
      "listing_count": 9,
      "lower_quartile_pkr": 4000000.0,
      "make": "Toyota",
      "median_mileage_km": 90000.0,
      "median_price_pkr": 4050000.0,
      "model": "Yaris",
      "model_year": 2020,
      "observed_through": "2026-10-31",
      "priced_listing_count": 9,
      "status": "ok",
      "transmission": "automatic",
      "upper_quartile_pkr": 4200000.0
    },
    {
      "city": "Karachi",
      "listing_count": 7,
      "lower_quartile_pkr": 4012500.0,
      "make": "Toyota",
      "median_mileage_km": 73250.0,
      "median_price_pkr": 4137500.0,
      "model": "Yaris",
      "model_year": 2021,
      "observed_through": "2026-10-30",
      "priced_listing_count": 6,
      "status": "ok",
      "transmission": "automatic",
      "upper_quartile_pkr": 4187500.0
    },
    {
      "city": "Lahore",
      "listing_count": 6,
      "lower_quartile_pkr": 4262500.0,
      "make": "Toyota",
      "median_mileage_km": 72500.0,
      "median_price_pkr": 4325000.0,
      "model": "Yaris",
      "model_year": 2021,
      "observed_through": "2026-10-31",
      "priced_listing_count": 6,
      "status": "ok",
      "transmission": "automatic",
      "upper_quartile_pkr": 4368750.0
    },
    {
      "city": "Karachi",
      "listing_count": 7,
      "lower_quartile_pkr": 4287500.0,
      "make": "Toyota",
      "median_mileage_km": 51000.0,
      "median_price_pkr": 4550000.0,
      "model": "Yaris",
      "model_year": 2022,
      "observed_through": "2026-10-31",
      "priced_listing_count": 7,
      "status": "ok",
      "transmission": "automatic",
      "upper_quartile_pkr": 4625000.0
    }
  ],
  "generated_at": "2026-10-31T19:16:57.762169Z",
  "schema_version": "1.1.0"
}
